{
  "$schema": "http://json-schema.org/draft-04/schema#",
  "id": "card-backs.json#",
  "title": "Schema for the card backs data file",
  "type": "object",
  "definitions": {},
  "properties": {
    "id": {
      "description": "Id for entry: a UUID (see docs/data-model.md).",
      "$ref": "definitions.json#/definitions/uuid"
    },
    "deck": {
      "type": "string",
      "description": "Deck name",
      "minLength": 1
    },
    "variant": {
      "description": "Variation or sub-type of the deck",
      "oneOf": [
        {
          "type": "string",
          "minLength": 1
        },
        {
          "type": "null"
        }
      ]
    },
    "content_type": {
      "description": "Content type for the component referenced on this entry.",
      "$ref": "definitions.json#/definitions/content_type"
    },
    "image": {
      "description": "The file path for this deck back's image.",
      "$ref": "definitions.json#/definitions/image-file-path"
    }
  },
  "required": [
    "id",
    "deck",
    "variant",
    "image"
  ],
  "additionalProperties": false
}